{
  "schemaVersion": "1.0",
  "adapterId": "<stable-adapter-id>",
  "provider": "<provider-id>",
  "protocol": "engloop-review-response-v2",
  "command": [
    "<executable>",
    "<argument>",
    ".engloop/provider-adapters/<adapter-artifact>"
  ],
  "commandArtifact": ".engloop/provider-adapters/<adapter-artifact>",
  "commandArtifactSha256": "<sha256>",
  "timeoutSeconds": 120,
  "capabilities": [
    "discover",
    "inspect",
    "reply",
    "resolve",
    "reply-and-resolve"
  ],
  "discoveryRequest": {}
}
